{"annotator_attestation":"INDEPENDENT_BLINDED_COMPLETE","annotator_id":"agent-B-astra-v4","annotator_slot":"B","atomic_labels":[{"annotation_notes":null,"item_id":"883b1f067fdf45db-a001","label":"SUPPORTED_BY_VISIBLE_EVIDENCE"},{"annotation_notes":null,"item_id":"883b1f067fdf45db-a002","label":"SUPPORTED_BY_VISIBLE_EVIDENCE"},{"annotation_notes":null,"item_id":"883b1f067fdf45db-a003","label":"SUPPORTED_BY_VISIBLE_EVIDENCE"},{"annotation_notes":null,"item_id":"883b1f067fdf45db-a004","label":"SUPPORTED_BY_VISIBLE_EVIDENCE"}],"false_premise_handling":"NOT_APPLICABLE","form_id":"883b1f067fdf45db-B","highest_asserted_abstraction_level":"recorded_override_state","limitation_preservation":[{"limitation_prompt":"Separate recorded outcome and diagnostics from unique physical causation or a measured explanation of bad/slow motion. Explicit uncertainty OR clearly source-bounded observation wording is acceptable. Do not claim a measured delay mechanism, obstacle identity, inhibited applied motion or safety-speed policy from these records.","preserved":true,"response_span":"These records do not establish a unique physical cause or a measured reason for navigation time."}],"packet_id":"883b1f067fdf45db","packet_set_sha256":"075950749f7e9a87094afcf614ef4d68b6b9fc3fcb72bce9ad331c9d2b955c75","required_unit_coverage":[{"communicated":true,"response_span":"The navigation skill reported a timeout.","unit_prompt":"Communicate that the recorded navigation failed/did not complete. Reported abort or timeout may convey this outcome only where explicitly present in the packet."},{"communicated":true,"response_span":"The latest received charging indicator was on.","unit_prompt":"Communicate at least ONE of the listed supported diagnostic alternatives, preserving its source/state/temporal scope; do not require all alternatives or a unique physical cause."}],"schema":"crane-blinded-atomic-annotation-return/v1"}
