{"annotator_attestation":"INDEPENDENT_BLINDED_COMPLETE","annotator_id":"agent-A-astra-v4","annotator_slot":"A","atomic_labels":[{"annotation_notes":"The recorded navigation outcome explicitly reports a timeout.","item_id":"a3cd27f5e1afb091-a001","label":"SUPPORTED_BY_VISIBLE_EVIDENCE"},{"annotation_notes":"The latest received charging indicator is true, with the same temporal and source scope.","item_id":"a3cd27f5e1afb091-a002","label":"SUPPORTED_BY_VISIBLE_EVIDENCE"},{"annotation_notes":"The supplied logs and indicator do not establish unique physical causation.","item_id":"a3cd27f5e1afb091-a003","label":"SUPPORTED_BY_VISIBLE_EVIDENCE"},{"annotation_notes":"No independent measurement establishing a reason for navigation time is supplied.","item_id":"a3cd27f5e1afb091-a004","label":"SUPPORTED_BY_VISIBLE_EVIDENCE"}],"false_premise_handling":"NOT_APPLICABLE","form_id":"a3cd27f5e1afb091-A","highest_asserted_abstraction_level":"recorded_override_state","limitation_preservation":[{"limitation_prompt":"Separate recorded outcome and diagnostics from unique physical causation or a measured explanation of bad/slow motion. Explicit uncertainty OR clearly source-bounded observation wording is acceptable. Do not claim a measured delay mechanism, obstacle identity, inhibited applied motion or safety-speed policy from these records.","preserved":true,"response_span":"These records do not establish a unique physical cause or a measured reason for navigation time."}],"packet_id":"a3cd27f5e1afb091","packet_set_sha256":"e628eff66ef2f8794e6ea6d4f7b6652b25491f871cf6a343497c2c99e98cb743","required_unit_coverage":[{"communicated":true,"response_span":"The navigation skill reported a timeout.","unit_prompt":"Communicate that the recorded navigation failed/did not complete. Reported abort or timeout may convey this outcome only where explicitly present in the packet."},{"communicated":true,"response_span":"The latest received charging indicator was on.","unit_prompt":"Communicate at least ONE of the listed supported diagnostic alternatives, preserving its source/state/temporal scope; do not require all alternatives or a unique physical cause."}],"schema":"crane-blinded-atomic-annotation-return/v1"}
