{"annotator_attestation":"INDEPENDENT_BLINDED_COMPLETE","annotator_id":"agent-A-astra-v4","annotator_slot":"A","atomic_labels":[{"annotation_notes":"The recorded navigation status is failed, with an explicit abort.","item_id":"dec6d1bd0a065f97-a001","label":"SUPPORTED_BY_VISIBLE_EVIDENCE"},{"annotation_notes":"Repeated planner failures support this episode-scoped inability to find a valid path; it does not assert that no geometrically feasible route exists.","item_id":"dec6d1bd0a065f97-a002","label":"SUPPORTED_BY_VISIBLE_EVIDENCE"},{"annotation_notes":"The planner failures, empty-path controller aborts, and final navigation failure support the explanation at the software execution level.","item_id":"dec6d1bd0a065f97-a003","label":"SUPPORTED_BY_VISIBLE_EVIDENCE"}],"false_premise_handling":"NOT_APPLICABLE","form_id":"dec6d1bd0a065f97-A","highest_asserted_abstraction_level":"software_action_failure","limitation_preservation":[{"limitation_prompt":"Separate recorded outcome and diagnostics from unique physical causation or a measured explanation of bad/slow motion. Explicit uncertainty OR clearly source-bounded observation wording is acceptable. Do not claim a measured delay mechanism, obstacle identity, inhibited applied motion or safety-speed policy from these records.","preserved":true,"response_span":"I couldn't reach the destination because I couldn't find a valid path to it."}],"packet_id":"dec6d1bd0a065f97","packet_set_sha256":"c0a30ab40316aa7e1c7f60f29e74fc03a7e8665de5c8c26eafe0dbedc9dbcbd4","required_unit_coverage":[{"communicated":true,"response_span":"I couldn't reach the destination","unit_prompt":"Communicate that the recorded navigation failed/did not complete. Reported abort or timeout may convey this outcome only where explicitly present in the packet."},{"communicated":true,"response_span":"I couldn't find a valid path to it.","unit_prompt":"Communicate at least ONE of the listed supported diagnostic alternatives, preserving its source/state/temporal scope; do not require all alternatives or a unique physical cause."}],"schema":"crane-blinded-atomic-annotation-return/v1"}
