{"annotator_attestation":"INDEPENDENT_BLINDED_COMPLETE","annotator_id":"agent-A-astra-v4","annotator_slot":"A","atomic_labels":[{"annotation_notes":"Navigation success is recorded in s0001 and the skill completion logs l0026 and l0034.","item_id":"4f563006fc79df54-a001","label":"SUPPORTED_BY_VISIBLE_EVIDENCE"},{"annotation_notes":"Planner logs l0004, l0005, l0016 and l0017 report failure to generate a valid path.","item_id":"4f563006fc79df54-a002","label":"SUPPORTED_BY_VISIBLE_EVIDENCE"},{"annotation_notes":"The supplied execution records do not identify a unique physical cause.","item_id":"4f563006fc79df54-a003","label":"SUPPORTED_BY_VISIBLE_EVIDENCE"},{"annotation_notes":"The records provide no measured causal explanation for navigation time.","item_id":"4f563006fc79df54-a004","label":"SUPPORTED_BY_VISIBLE_EVIDENCE"}],"false_premise_handling":"NOT_APPLICABLE","form_id":"4f563006fc79df54-A","highest_asserted_abstraction_level":"software_action_failure","limitation_preservation":[{"limitation_prompt":"Separate recorded outcome and diagnostics from unique physical causation or a measured explanation of bad/slow motion. Explicit uncertainty OR clearly source-bounded observation wording is acceptable. Do not claim a measured delay mechanism, obstacle identity, inhibited applied motion or safety-speed policy from these records.","preserved":true,"response_span":"These records do not establish a unique physical cause or a measured reason for navigation time."}],"packet_id":"4f563006fc79df54","packet_set_sha256":"6d8a6120ee5179627308383b21c9b8d758741cd0207b62d49bd67ca201aa7bbc","required_unit_coverage":[{"communicated":true,"response_span":"The recorded navigation skills succeeded.","unit_prompt":"Communicate that the recorded navigation completed successfully. Do not accept a failed-navigation answer as coverage of this SUCCESS unit."},{"communicated":true,"response_span":"The planner reported that it could not generate a valid path.","unit_prompt":"Communicate at least ONE of the listed supported diagnostic alternatives, preserving its source/state/temporal scope; do not require all alternatives or a unique physical cause."}],"schema":"crane-blinded-atomic-annotation-return/v1"}
