{"annotator_attestation":"INDEPENDENT_BLINDED_COMPLETE","annotator_id":"agent-A-astra-v4","annotator_slot":"A","atomic_labels":[{"annotation_notes":"Recorded navigation outcomes and completion logs support success.","item_id":"3a20c44b602db63f-a001","label":"SUPPORTED_BY_VISIBLE_EVIDENCE"},{"annotation_notes":"The supplied records do not establish unique physical causation.","item_id":"3a20c44b602db63f-a002","label":"SUPPORTED_BY_VISIBLE_EVIDENCE"},{"annotation_notes":"The supplied records contain no measured causal explanation for navigation time.","item_id":"3a20c44b602db63f-a003","label":"SUPPORTED_BY_VISIBLE_EVIDENCE"}],"false_premise_handling":"NOT_APPLICABLE","form_id":"3a20c44b602db63f-A","highest_asserted_abstraction_level":"task_outcome","limitation_preservation":[{"limitation_prompt":"Separate recorded outcome and diagnostics from unique physical causation or a measured explanation of bad/slow motion. Explicit uncertainty OR clearly source-bounded observation wording is acceptable. Do not claim a measured delay mechanism, obstacle identity, inhibited applied motion or safety-speed policy from these records.","preserved":true,"response_span":"These records do not establish a unique physical cause or a measured reason for navigation time."}],"packet_id":"3a20c44b602db63f","packet_set_sha256":"02578fd6adfca781bf8ebc4e631da5bffe076929626b018798da4dd1fe69e20b","required_unit_coverage":[{"communicated":true,"response_span":"The recorded navigation skills succeeded.","unit_prompt":"Communicate that the recorded navigation completed successfully. Do not accept a failed-navigation answer as coverage of this SUCCESS unit."}],"schema":"crane-blinded-atomic-annotation-return/v1"}
