{"annotator_attestation":"INDEPENDENT_BLINDED_COMPLETE","annotator_id":"agent-A-astra-v4","annotator_slot":"A","atomic_labels":[{"annotation_notes":"s0001 records failed navigation with an explicit abort error.","item_id":"77801b9047852a09-a001","label":"SUPPORTED_BY_VISIBLE_EVIDENCE"},{"annotation_notes":"Planner logs report failure to generate a valid path during recorded attempts.","item_id":"77801b9047852a09-a002","label":"SUPPORTED_BY_VISIBLE_EVIDENCE"},{"annotation_notes":"The supplied software observations do not establish a unique physical cause.","item_id":"77801b9047852a09-a003","label":"SUPPORTED_BY_VISIBLE_EVIDENCE"},{"annotation_notes":"No supplied measurement establishes a reason for navigation time.","item_id":"77801b9047852a09-a004","label":"SUPPORTED_BY_VISIBLE_EVIDENCE"}],"false_premise_handling":"NOT_APPLICABLE","form_id":"77801b9047852a09-A","highest_asserted_abstraction_level":"software_action_failure","limitation_preservation":[{"limitation_prompt":"Separate recorded outcome and diagnostics from unique physical causation or a measured explanation of bad/slow motion. Explicit uncertainty OR clearly source-bounded observation wording is acceptable. Do not claim a measured delay mechanism, obstacle identity, inhibited applied motion or safety-speed policy from these records.","preserved":true,"response_span":"These records do not establish a unique physical cause or a measured reason for navigation time."}],"packet_id":"77801b9047852a09","packet_set_sha256":"7f4b32b55cc506f734efde37e738d8e1943bd64c754e1dc01efead719a2e16fc","required_unit_coverage":[{"communicated":true,"response_span":"The navigation skill reported an abort.","unit_prompt":"Communicate that the recorded navigation failed/did not complete. Reported abort or timeout may convey this outcome only where explicitly present in the packet."},{"communicated":true,"response_span":"The planner reported that it could not generate a valid path.","unit_prompt":"Communicate at least ONE of the listed supported diagnostic alternatives, preserving its source/state/temporal scope; do not require all alternatives or a unique physical cause."}],"schema":"crane-blinded-atomic-annotation-return/v1"}
