{"annotator_attestation":"INDEPENDENT_BLINDED_COMPLETE","annotator_id":"agent-B-astra-v4","annotator_slot":"B","atomic_labels":[{"annotation_notes":"Recorded navigation outcomes and completion logs support success.","item_id":"8d34fe9660a28a98-a001","label":"SUPPORTED_BY_VISIBLE_EVIDENCE"},{"annotation_notes":"The records do not establish a unique physical cause.","item_id":"8d34fe9660a28a98-a002","label":"SUPPORTED_BY_VISIBLE_EVIDENCE"},{"annotation_notes":"The records provide no measured explanation for navigation time.","item_id":"8d34fe9660a28a98-a003","label":"SUPPORTED_BY_VISIBLE_EVIDENCE"}],"false_premise_handling":"NOT_APPLICABLE","form_id":"8d34fe9660a28a98-B","highest_asserted_abstraction_level":"task_outcome","limitation_preservation":[{"limitation_prompt":"Separate recorded outcome and diagnostics from unique physical causation or a measured explanation of bad/slow motion. Explicit uncertainty OR clearly source-bounded observation wording is acceptable. Do not claim a measured delay mechanism, obstacle identity, inhibited applied motion or safety-speed policy from these records.","preserved":true,"response_span":"These records do not establish a unique physical cause or a measured reason for navigation time."}],"packet_id":"8d34fe9660a28a98","packet_set_sha256":"5955ac010a9a119b0923c627cd5cbba118558e68503e9bb78ce5c66b23a52558","required_unit_coverage":[{"communicated":true,"response_span":"The recorded navigation skills succeeded.","unit_prompt":"Communicate that the recorded navigation completed successfully. Do not accept a failed-navigation answer as coverage of this SUCCESS unit."}],"schema":"crane-blinded-atomic-annotation-return/v1"}
