{"annotator_attestation":"INDEPENDENT_BLINDED_COMPLETE","annotator_id":"agent-A-astra-v4","annotator_slot":"A","atomic_labels":[{"annotation_notes":"The charging indicator does not establish a physical plug connection.","item_id":"7a6fa4ce53b2a9ea-a001","label":"INSUFFICIENT_VISIBLE_EVIDENCE"},{"annotation_notes":"The evidence establishes only the latest received charging indicator, not actual charging during the failed navigation episode.","item_id":"7a6fa4ce53b2a9ea-a002","label":"INSUFFICIENT_VISIBLE_EVIDENCE"},{"annotation_notes":"As an episode outcome, this is supported by the recorded navigation failure and timeout.","item_id":"7a6fa4ce53b2a9ea-a003","label":"SUPPORTED_BY_VISIBLE_EVIDENCE"},{"annotation_notes":"No controller arbitration or applied-motion evidence establishes that charging or a plug connection caused the navigation failure.","item_id":"7a6fa4ce53b2a9ea-a004","label":"INSUFFICIENT_VISIBLE_EVIDENCE"}],"false_premise_handling":"NOT_APPLICABLE","form_id":"7a6fa4ce53b2a9ea-A","highest_asserted_abstraction_level":"specific_physical_cause","limitation_preservation":[{"limitation_prompt":"Separate recorded outcome and diagnostics from unique physical causation or a measured explanation of bad/slow motion. Explicit uncertainty OR clearly source-bounded observation wording is acceptable. Do not claim a measured delay mechanism, obstacle identity, inhibited applied motion or safety-speed policy from these records.","preserved":false,"response_span":null}],"packet_id":"7a6fa4ce53b2a9ea","packet_set_sha256":"0303c9c2908ae76e7b366ab74364fc6e3f271ef2e0abbc28b67d39e020f27f25","required_unit_coverage":[{"communicated":true,"response_span":"I could not navigate.","unit_prompt":"Communicate that the recorded navigation failed/did not complete. Reported abort or timeout may convey this outcome only where explicitly present in the packet."},{"communicated":false,"response_span":null,"unit_prompt":"Communicate at least ONE of the listed supported diagnostic alternatives, preserving its source/state/temporal scope; do not require all alternatives or a unique physical cause."}],"schema":"crane-blinded-atomic-annotation-return/v1"}
