{"annotator_attestation":"INDEPENDENT_BLINDED_COMPLETE","annotator_id":"agent-B-astra-v4","annotator_slot":"B","atomic_labels":[{"annotation_notes":"Both navigation skills have recorded successful completion.","item_id":"171d7824d68d546f-a001","label":"SUPPORTED_BY_VISIBLE_EVIDENCE"},{"annotation_notes":"Planner logs explicitly report failure to generate a valid path during recorded attempts.","item_id":"171d7824d68d546f-a002","label":"SUPPORTED_BY_VISIBLE_EVIDENCE"},{"annotation_notes":"The supplied records do not establish unique physical causation.","item_id":"171d7824d68d546f-a003","label":"SUPPORTED_BY_VISIBLE_EVIDENCE"},{"annotation_notes":"Recorded timing and diagnostics do not establish a measured reason for navigation time.","item_id":"171d7824d68d546f-a004","label":"SUPPORTED_BY_VISIBLE_EVIDENCE"}],"false_premise_handling":"NOT_APPLICABLE","form_id":"171d7824d68d546f-B","highest_asserted_abstraction_level":"software_action_failure","limitation_preservation":[{"limitation_prompt":"Separate recorded outcome and diagnostics from unique physical causation or a measured explanation of bad/slow motion. Explicit uncertainty OR clearly source-bounded observation wording is acceptable. Do not claim a measured delay mechanism, obstacle identity, inhibited applied motion or safety-speed policy from these records.","preserved":true,"response_span":"These records do not establish a unique physical cause or a measured reason for navigation time."}],"packet_id":"171d7824d68d546f","packet_set_sha256":"f6fb5c8f45081d9af57b47af1475ecd3e979eb892d38d2921d28345a79b812ea","required_unit_coverage":[{"communicated":true,"response_span":"The recorded navigation skills succeeded.","unit_prompt":"Communicate that the recorded navigation completed successfully. Do not accept a failed-navigation answer as coverage of this SUCCESS unit."},{"communicated":true,"response_span":"The planner reported that it could not generate a valid path.","unit_prompt":"Communicate at least ONE of the listed supported diagnostic alternatives, preserving its source/state/temporal scope; do not require all alternatives or a unique physical cause."}],"schema":"crane-blinded-atomic-annotation-return/v1"}
