{"annotator_attestation":"INDEPENDENT_BLINDED_COMPLETE","annotator_id":"agent-B-astra-v4","annotator_slot":"B","atomic_labels":[{"annotation_notes":"The recorded task names living_room as the navigation destination, and the logs establish that navigation execution began.","item_id":"9d8ca313d88835c4-a001","label":"SUPPORTED_BY_VISIBLE_EVIDENCE"},{"annotation_notes":null,"item_id":"9d8ca313d88835c4-a002","label":"SUPPORTED_BY_VISIBLE_EVIDENCE"},{"annotation_notes":null,"item_id":"9d8ca313d88835c4-a003","label":"SUPPORTED_BY_VISIBLE_EVIDENCE"},{"annotation_notes":null,"item_id":"9d8ca313d88835c4-a004","label":"SUPPORTED_BY_VISIBLE_EVIDENCE"},{"annotation_notes":null,"item_id":"9d8ca313d88835c4-a005","label":"SUPPORTED_BY_VISIBLE_EVIDENCE"},{"annotation_notes":null,"item_id":"9d8ca313d88835c4-a006","label":"SUPPORTED_BY_VISIBLE_EVIDENCE"},{"annotation_notes":null,"item_id":"9d8ca313d88835c4-a007","label":"SUPPORTED_BY_VISIBLE_EVIDENCE"},{"annotation_notes":null,"item_id":"9d8ca313d88835c4-a008","label":"SUPPORTED_BY_VISIBLE_EVIDENCE"},{"annotation_notes":null,"item_id":"9d8ca313d88835c4-a009","label":"SUPPORTED_BY_VISIBLE_EVIDENCE"},{"annotation_notes":null,"item_id":"9d8ca313d88835c4-a010","label":"SUPPORTED_BY_VISIBLE_EVIDENCE"}],"false_premise_handling":"NOT_APPLICABLE","form_id":"9d8ca313d88835c4-B","highest_asserted_abstraction_level":"recorded_override_state","limitation_preservation":[{"limitation_prompt":"Separate recorded outcome and diagnostics from unique physical causation or a measured explanation of bad/slow motion. Explicit uncertainty OR clearly source-bounded observation wording is acceptable. Do not claim a measured delay mechanism, obstacle identity, inhibited applied motion or safety-speed policy from these records.","preserved":true,"response_span":"The latest indicators showed manual mode on and charging off, but the physical cause of the failure is unknown."}],"packet_id":"9d8ca313d88835c4","packet_set_sha256":"3702552ab2e4eaf2544b7c63ac4b83150f4c180d700f1ffbc7e0f449560f8baa","required_unit_coverage":[{"communicated":true,"response_span":"I started navigating to the living room, but the navigation skill timed out.","unit_prompt":"Communicate that the recorded navigation failed/did not complete. Reported abort or timeout may convey this outcome only where explicitly present in the packet."},{"communicated":true,"response_span":"The controller received paths, repeatedly reported failure to make progress, and aborted; local and global costmap clearing was requested.","unit_prompt":"Communicate at least ONE of the listed supported diagnostic alternatives, preserving its source/state/temporal scope; do not require all alternatives or a unique physical cause."}],"schema":"crane-blinded-atomic-annotation-return/v1"}
