{"annotator_attestation":"INDEPENDENT_BLINDED_COMPLETE","annotator_id":"agent-A-astra-v4","annotator_slot":"A","atomic_labels":[{"annotation_notes":"s0001 explicitly records a failed navigation skill with a timeout error.","item_id":"c0acb27447b0afb2-a001","label":"SUPPORTED_BY_VISIBLE_EVIDENCE"},{"annotation_notes":"state-joy_priority is true and explicitly scoped to the latest received indicator.","item_id":"c0acb27447b0afb2-a002","label":"SUPPORTED_BY_VISIBLE_EVIDENCE"},{"annotation_notes":"The supplied records lack controller/arbitration and applied-motion evidence establishing a unique physical cause.","item_id":"c0acb27447b0afb2-a003","label":"SUPPORTED_BY_VISIBLE_EVIDENCE"},{"annotation_notes":"The timeout and indicator records do not establish a measured explanation for navigation time.","item_id":"c0acb27447b0afb2-a004","label":"SUPPORTED_BY_VISIBLE_EVIDENCE"}],"false_premise_handling":"NOT_APPLICABLE","form_id":"c0acb27447b0afb2-A","highest_asserted_abstraction_level":"recorded_override_state","limitation_preservation":[{"limitation_prompt":"Separate recorded outcome and diagnostics from unique physical causation or a measured explanation of bad/slow motion. Explicit uncertainty OR clearly source-bounded observation wording is acceptable. Do not claim a measured delay mechanism, obstacle identity, inhibited applied motion or safety-speed policy from these records.","preserved":true,"response_span":"These records do not establish a unique physical cause or a measured reason for navigation time."}],"packet_id":"c0acb27447b0afb2","packet_set_sha256":"f995ffdc963f3716500404038b83e18c3a26226ec19ba938fa16bfc6f0b670e4","required_unit_coverage":[{"communicated":true,"response_span":"The navigation skill reported a timeout.","unit_prompt":"Communicate that the recorded navigation failed/did not complete. Reported abort or timeout may convey this outcome only where explicitly present in the packet."},{"communicated":true,"response_span":"The latest received joystick-priority indicator was on.","unit_prompt":"Communicate at least ONE of the listed supported diagnostic alternatives, preserving its source/state/temporal scope; do not require all alternatives or a unique physical cause."}],"schema":"crane-blinded-atomic-annotation-return/v1"}
