{"annotator_attestation":"INDEPENDENT_BLINDED_COMPLETE","annotator_id":"agent-A-astra-v4","annotator_slot":"A","atomic_labels":[{"annotation_notes":"A path handoff is recorded, but path-computation time is not established as a reason for the perceived delay.","item_id":"7ea3aad58c1136dd-a001","label":"INSUFFICIENT_VISIBLE_EVIDENCE"},{"annotation_notes":"The records do not establish travel at a limited speed or its contribution to elapsed time.","item_id":"7ea3aad58c1136dd-a002","label":"INSUFFICIENT_VISIBLE_EVIDENCE"},{"annotation_notes":"No applied-speed measurement or speed-limit evidence is supplied.","item_id":"7ea3aad58c1136dd-a003","label":"INSUFFICIENT_VISIBLE_EVIDENCE"},{"annotation_notes":"Successful navigation does not establish a safety-speed policy or its application.","item_id":"7ea3aad58c1136dd-a004","label":"INSUFFICIENT_VISIBLE_EVIDENCE"}],"false_premise_handling":"NOT_APPLICABLE","form_id":"7ea3aad58c1136dd-A","highest_asserted_abstraction_level":"specific_physical_cause","limitation_preservation":[{"limitation_prompt":"Separate recorded outcome and diagnostics from unique physical causation or a measured explanation of bad/slow motion. Explicit uncertainty OR clearly source-bounded observation wording is acceptable. Do not claim a measured delay mechanism, obstacle identity, inhibited applied motion or safety-speed policy from these records.","preserved":false,"response_span":null}],"packet_id":"7ea3aad58c1136dd","packet_set_sha256":"77132a04da42d1e3c46aa1077bdc312fa63341acbc2783ef024cfa465505ac17","required_unit_coverage":[{"communicated":false,"response_span":null,"unit_prompt":"Communicate that the recorded navigation completed successfully. Do not accept a failed-navigation answer as coverage of this SUCCESS unit."}],"schema":"crane-blinded-atomic-annotation-return/v1"}
