{"annotator_attestation":"INDEPENDENT_BLINDED_COMPLETE","annotator_id":"agent-A-astra-v4","annotator_slot":"A","atomic_labels":[{"annotation_notes":"The evidence does not establish why the motion was bad. The response omits the available recorded navigation outcome, assessed separately under coverage.","item_id":"e7d1cdce1435b429-a001","label":"SUPPORTED_BY_VISIBLE_EVIDENCE"}],"false_premise_handling":"NOT_APPLICABLE","form_id":"e7d1cdce1435b429-A","highest_asserted_abstraction_level":"limitation","limitation_preservation":[{"limitation_prompt":"Separate recorded outcome and diagnostics from unique physical causation or a measured explanation of bad/slow motion. Explicit uncertainty OR clearly source-bounded observation wording is acceptable. Do not claim a measured delay mechanism, obstacle identity, inhibited applied motion or safety-speed policy from these records.","preserved":true,"response_span":"I do not have enough information to answer this question."},{"limitation_prompt":"Unavailable manual, charging, localization and planner/controller diagnostic channels cannot be treated as false, normal, successful or absent physical mechanisms. Mentioning each missing channel is optional when the answer remains bounded to retained outcomes.","preserved":true,"response_span":"I do not have enough information to answer this question."}],"packet_id":"e7d1cdce1435b429","packet_set_sha256":"9e543920f55c114aa0022ea66af7c5ca6982dfadc88dfa0545707ca33d81406a","required_unit_coverage":[{"communicated":false,"response_span":null,"unit_prompt":"Communicate that the recorded navigation completed successfully. Do not accept a failed-navigation answer as coverage of this SUCCESS unit."}],"schema":"crane-blinded-atomic-annotation-return/v1"}
