{"annotator_attestation":"INDEPENDENT_BLINDED_COMPLETE","annotator_id":"agent-A-astra-v4","annotator_slot":"A","atomic_labels":[{"annotation_notes":"The recorded navigation to living_room failed and was aborted.","item_id":"ab3dc0cc2749c0d8-a001","label":"SUPPORTED_BY_VISIBLE_EVIDENCE"},{"annotation_notes":"Repeated planner logs explicitly report failure to generate a valid path to these coordinates.","item_id":"ab3dc0cc2749c0d8-a002","label":"SUPPORTED_BY_VISIBLE_EVIDENCE"},{"annotation_notes":"The navigation outcome explicitly reports that the skill was aborted.","item_id":"ab3dc0cc2749c0d8-a003","label":"SUPPORTED_BY_VISIBLE_EVIDENCE"},{"annotation_notes":"Supported as a bounded software execution explanation, without asserting global route infeasibility or a physical cause.","item_id":"ab3dc0cc2749c0d8-a004","label":"SUPPORTED_BY_VISIBLE_EVIDENCE"},{"annotation_notes":"The recorded ask_human_for_help skill has status waiting.","item_id":"ab3dc0cc2749c0d8-a005","label":"SUPPORTED_BY_VISIBLE_EVIDENCE"},{"annotation_notes":"Pending skill statuses do not establish whether the robot physically obtained the bottle; no acquisition or possession observation is supplied.","item_id":"ab3dc0cc2749c0d8-a006","label":"INSUFFICIENT_VISIBLE_EVIDENCE"},{"annotation_notes":"The waiting status does not establish non-acquisition of the bottle or its cause.","item_id":"ab3dc0cc2749c0d8-a007","label":"INSUFFICIENT_VISIBLE_EVIDENCE"},{"annotation_notes":"The logs establish planning failures but do not establish their underlying cause.","item_id":"ab3dc0cc2749c0d8-a008","label":"SUPPORTED_BY_VISIBLE_EVIDENCE"}],"false_premise_handling":"NOT_APPLICABLE","form_id":"ab3dc0cc2749c0d8-A","highest_asserted_abstraction_level":"software_action_failure","limitation_preservation":[{"limitation_prompt":"Separate recorded outcome and diagnostics from unique physical causation or a measured explanation of bad/slow motion. Explicit uncertainty OR clearly source-bounded observation wording is acceptable. Do not claim a measured delay mechanism, obstacle identity, inhibited applied motion or safety-speed policy from these records.","preserved":true,"response_span":"The logs don\u2019t establish why the planner couldn\u2019t find a path."}],"packet_id":"ab3dc0cc2749c0d8","packet_set_sha256":"2f1eef58de425ca80f54f36314a67e3c2e3af21c61bd93480a578545bbdf9f94","required_unit_coverage":[{"communicated":true,"response_span":"navigation was aborted.","unit_prompt":"Communicate that the recorded navigation failed/did not complete. Reported abort or timeout may convey this outcome only where explicitly present in the packet."},{"communicated":true,"response_span":"the planner repeatedly reported no valid path to (3.07, -0.34)","unit_prompt":"Communicate at least ONE of the listed supported diagnostic alternatives, preserving its source/state/temporal scope; do not require all alternatives or a unique physical cause."}],"schema":"crane-blinded-atomic-annotation-return/v1"}
