{"annotator_attestation":"INDEPENDENT_BLINDED_COMPLETE","annotator_id":"agent-A-astra-v4","annotator_slot":"A","atomic_labels":[{"annotation_notes":"The evidence establishes only the latest received charging indicator, without establishing charging during the navigation episode.","item_id":"2ca9bcb119431e7b-a001","label":"INSUFFICIENT_VISIBLE_EVIDENCE"},{"annotation_notes":"The recorded navigation failed with an explicit timeout, supporting the episode-level navigation outcome.","item_id":"2ca9bcb119431e7b-a002","label":"SUPPORTED_BY_VISIBLE_EVIDENCE"},{"annotation_notes":"The charging indicator and navigation failure do not establish that charging caused the failure or inhibited motion.","item_id":"2ca9bcb119431e7b-a003","label":"INSUFFICIENT_VISIBLE_EVIDENCE"}],"false_premise_handling":"NOT_APPLICABLE","form_id":"2ca9bcb119431e7b-A","highest_asserted_abstraction_level":"specific_physical_cause","limitation_preservation":[{"limitation_prompt":"Separate recorded outcome and diagnostics from unique physical causation or a measured explanation of bad/slow motion. Explicit uncertainty OR clearly source-bounded observation wording is acceptable. Do not claim a measured delay mechanism, obstacle identity, inhibited applied motion or safety-speed policy from these records.","preserved":false,"response_span":null}],"packet_id":"2ca9bcb119431e7b","packet_set_sha256":"babcfdbefdfcc38671622ece1b882b34e38104943917e12eeaa956950ef4f132","required_unit_coverage":[{"communicated":true,"response_span":"I could not navigate.","unit_prompt":"Communicate that the recorded navigation failed/did not complete. Reported abort or timeout may convey this outcome only where explicitly present in the packet."},{"communicated":false,"response_span":null,"unit_prompt":"Communicate at least ONE of the listed supported diagnostic alternatives, preserving its source/state/temporal scope; do not require all alternatives or a unique physical cause."}],"schema":"crane-blinded-atomic-annotation-return/v1"}
