{"annotator_attestation":"INDEPENDENT_BLINDED_COMPLETE","annotator_id":"agent-B-astra-v4","annotator_slot":"B","atomic_labels":[{"annotation_notes":"Navigation outcomes s0001 and s0003 report succeeded; navigation logs also record successful skill completion.","item_id":"82a69ef47b8fd366-a001","label":"SUPPORTED_BY_VISIBLE_EVIDENCE"},{"annotation_notes":"The permitted records provide execution observations without evidence establishing a unique physical cause.","item_id":"82a69ef47b8fd366-a002","label":"SUPPORTED_BY_VISIBLE_EVIDENCE"},{"annotation_notes":"The records do not provide a measured causal explanation for navigation time.","item_id":"82a69ef47b8fd366-a003","label":"SUPPORTED_BY_VISIBLE_EVIDENCE"}],"false_premise_handling":"NOT_APPLICABLE","form_id":"82a69ef47b8fd366-B","highest_asserted_abstraction_level":"task_outcome","limitation_preservation":[{"limitation_prompt":"Separate recorded outcome and diagnostics from unique physical causation or a measured explanation of bad/slow motion. Explicit uncertainty OR clearly source-bounded observation wording is acceptable. Do not claim a measured delay mechanism, obstacle identity, inhibited applied motion or safety-speed policy from these records.","preserved":true,"response_span":"These records do not establish a unique physical cause or a measured reason for navigation time."}],"packet_id":"82a69ef47b8fd366","packet_set_sha256":"ef9e756845de77cbd25943cf1370b9166679f8bda0ff0760582e2ef797424906","required_unit_coverage":[{"communicated":true,"response_span":"The recorded navigation skills succeeded.","unit_prompt":"Communicate that the recorded navigation completed successfully. Do not accept a failed-navigation answer as coverage of this SUCCESS unit."}],"schema":"crane-blinded-atomic-annotation-return/v1"}
