{"annotator_attestation":"INDEPENDENT_BLINDED_COMPLETE","annotator_id":"agent-A-astra-v4","annotator_slot":"A","atomic_labels":[{"annotation_notes":"The recorded fetch sequence stopped at failed navigation; book acquisition and return remained waiting.","item_id":"4345e0061047f316-a001","label":"SUPPORTED_BY_VISIBLE_EVIDENCE"},{"annotation_notes":"The recorded living_room navigation failed with the explicit error that the skill was aborted.","item_id":"4345e0061047f316-a002","label":"SUPPORTED_BY_VISIBLE_EVIDENCE"},{"annotation_notes":"The ordered task sequence supports aborted navigation as the execution-level explanation for non-delivery, without identifying a physical cause.","item_id":"4345e0061047f316-a003","label":"SUPPORTED_BY_VISIBLE_EVIDENCE"},{"annotation_notes":"Repeated planner logs explicitly report failure to generate a valid path.","item_id":"4345e0061047f316-a004","label":"SUPPORTED_BY_VISIBLE_EVIDENCE"},{"annotation_notes":"Repeated controller logs explicitly report an invalid, empty path.","item_id":"4345e0061047f316-a005","label":"SUPPORTED_BY_VISIBLE_EVIDENCE"},{"annotation_notes":"The supplied software diagnostics do not establish the underlying cause of path unavailability.","item_id":"4345e0061047f316-a006","label":"SUPPORTED_BY_VISIBLE_EVIDENCE"}],"false_premise_handling":"NOT_APPLICABLE","form_id":"4345e0061047f316-A","highest_asserted_abstraction_level":"software_action_failure","limitation_preservation":[{"limitation_prompt":"Separate recorded outcome and diagnostics from unique physical causation or a measured explanation of bad/slow motion. Explicit uncertainty OR clearly source-bounded observation wording is acceptable. Do not claim a measured delay mechanism, obstacle identity, inhibited applied motion or safety-speed policy from these records.","preserved":true,"response_span":"I can\u2019t tell from these records why a path was unavailable."}],"packet_id":"4345e0061047f316","packet_set_sha256":"ee152e590572ca781744ab6754f6d3385d568dd1ab93fdfb0b0573540ed123e0","required_unit_coverage":[{"communicated":true,"response_span":"navigation to the living room was aborted.","unit_prompt":"Communicate that the recorded navigation failed/did not complete. Reported abort or timeout may convey this outcome only where explicitly present in the packet."},{"communicated":true,"response_span":"The planner repeatedly reported no valid path, and the controller reported empty paths.","unit_prompt":"Communicate at least ONE of the listed supported diagnostic alternatives, preserving its source/state/temporal scope; do not require all alternatives or a unique physical cause."}],"schema":"crane-blinded-atomic-annotation-return/v1"}
